{
  "cache_protocol": "cold_stream",
  "content_kind": "mechanical",
  "counting_policy": "total_server_prompt_including_template",
  "dependency_policy_path": null,
  "dispatch_duration_s": 126.48984409100001,
  "history_mode": "single_turn",
  "input_tokens_total": null,
  "load_multiplier": 1.0,
  "load_unit": "requests_per_s",
  "model_id": "Qwen/Qwen3.8-27B",
  "model_revision": "1d4bf0f2ff6012fd82039f2fa52739d0dd7c60c0",
  "n_planned": 384,
  "notes": "Frozen from a real B0 source cell; requires independent native replay validation.",
  "offered_load": 3.0279110765956836,
  "offered_rps": 3.0279110765956836,
  "output_policy": "forced_length",
  "output_tokens_fixed": 256,
  "payload_path": "configs/workloads/ops-frozen/qwen-ops-chat-high-v1.jsonl",
  "payload_sha256": "403eefde971edd7b53b7666187916754ece8d35dc8d365381fab77d4736846f0",
  "prefix_fraction": 0.0,
  "prefix_pool_size": 0,
  "preparation_policy_path": "configs/workloads/ops-preparation.json",
  "protocol_id": "ops-aiperf013-qwen-fresh-warm3-fixed-v1",
  "readiness": "prepared",
  "scenario_id": "qwen-ops-chat-high-v1",
  "schedule_path": "configs/workloads/ops-frozen/qwen-ops-chat-high-v1.jsonl",
  "schedule_sha256": "403eefde971edd7b53b7666187916754ece8d35dc8d365381fab77d4736846f0",
  "schema_version": "0.2",
  "seeds": {
    "arrivals": 42,
    "content": 42,
    "prefix": 0
  },
  "source_manifest": {
    "characterization_status": "not_applicable",
    "limitations": [
      "Synthetic source, not a measured deployment distribution."
    ],
    "revision_or_hash": "bde2dede2a8af03a92b8569e8b983b03da5407e351940f0a010acfe227cd36d8",
    "source_id": "ops_aiperf/chat",
    "split": "diagnostic"
  },
  "suite_role": "diagnostic",
  "template_hash": "c3cf9e34abf4f9e36c2d72165aa9c132d3e2a725b6c2586aaa3a8af9d7a81041",
  "tokenizer_revision": "1d4bf0f2ff6012fd82039f2fa52739d0dd7c60c0",
  "traffic_mode": "independent_open_loop",
  "workload_card_path": "configs/workloads/ops-frozen/qwen-ops-chat-high-v1.card.json",
  "workload_card_sha256": "2efb9d2983bf9004e6a214380389b502b481dcc0ef81e21e9d12b22bb8a06330",
  "workload_group_id": "ops-aiperf-chat-qwen-cold-v1",
  "workload_name": "ops-aiperf-chat"
}
