{
  "cache_protocol": "cold_stream",
  "content_kind": "mechanical",
  "counting_policy": "total_server_prompt_including_template",
  "dependency_policy_path": null,
  "dispatch_duration_s": 176.450820566,
  "history_mode": "single_turn",
  "input_tokens_total": null,
  "load_multiplier": 1.0,
  "load_unit": "requests_per_s",
  "model_id": "Qwen/Qwen3.8-27B",
  "model_revision": "1d4bf0f2ff6012fd82039f2fa52739d0dd7c60c0",
  "n_planned": 54,
  "notes": "Frozen from a real B0 source cell; requires independent native replay validation.",
  "offered_load": 0.30036697947899754,
  "offered_rps": 0.30036697947899754,
  "output_policy": "forced_length",
  "output_tokens_fixed": 1024,
  "payload_path": "configs/workloads/ops-frozen/qwen-ops-agent-high-v1.jsonl",
  "payload_sha256": "9944c17eb958ce539eed28cc7cbfd0207f6fac29a4e236275a4b582382ad5bd3",
  "prefix_fraction": 0.0,
  "prefix_pool_size": 0,
  "preparation_policy_path": "configs/workloads/ops-preparation.json",
  "protocol_id": "ops-aiperf013-qwen-fresh-warm3-fixed-v1",
  "readiness": "prepared",
  "scenario_id": "qwen-ops-agent-high-v1",
  "schedule_path": "configs/workloads/ops-frozen/qwen-ops-agent-high-v1.jsonl",
  "schedule_sha256": "9944c17eb958ce539eed28cc7cbfd0207f6fac29a4e236275a4b582382ad5bd3",
  "schema_version": "0.2",
  "seeds": {
    "arrivals": 42,
    "content": 42,
    "prefix": 0
  },
  "source_manifest": {
    "characterization_status": "not_applicable",
    "limitations": [
      "Synthetic source, not a measured deployment distribution."
    ],
    "revision_or_hash": "e157634847d536c7784f24398dce676a543d2d0c371a2496f21cd3fa9fdc727c",
    "source_id": "ops_aiperf/agent",
    "split": "diagnostic"
  },
  "suite_role": "diagnostic",
  "template_hash": "c3cf9e34abf4f9e36c2d72165aa9c132d3e2a725b6c2586aaa3a8af9d7a81041",
  "tokenizer_revision": "1d4bf0f2ff6012fd82039f2fa52739d0dd7c60c0",
  "traffic_mode": "independent_open_loop",
  "workload_card_path": "configs/workloads/ops-frozen/qwen-ops-agent-high-v1.card.json",
  "workload_card_sha256": "0aea99be293881de997e33cf6f5a07a71cc392eb0b95f14174fdbbdf17a4b755",
  "workload_group_id": "ops-aiperf-agent-qwen-cold-v1",
  "workload_name": "ops-aiperf-agent"
}
