{
  "schema_version": "0.2",
  "readiness": "example_only",
  "scenario_id": "example-agent-f75-rate080-screen",
  "workload_group_id": "example-agent-f75-prewarmed-screen-v1",
  "workload_name": "agent",
  "input_tokens_total": 8192,
  "output_tokens_fixed": 1024,
  "prefix_fraction": 0.75,
  "prefix_pool_size": 64,
  "cache_protocol": "prefix_prewarmed",
  "model_id": "Qwen/Qwen3.8-27B",
  "model_revision": "UNRESOLVED",
  "tokenizer_revision": "UNRESOLVED",
  "template_hash": "UNRESOLVED",
  "content_kind": "mechanical",
  "payload_path": "TO_BE_PREPARED/payloads.jsonl",
  "payload_sha256": "UNRESOLVED",
  "schedule_path": "TO_BE_PREPARED/schedule.jsonl",
  "schedule_sha256": "UNRESOLVED",
  "offered_rps": 1,
  "load_multiplier": 0.8,
  "dispatch_duration_s": 120,
  "n_planned": 120,
  "seeds": {
    "content": 17,
    "prefix": 23,
    "arrivals": 31
  },
  "protocol_id": "screen-prewarmed-effective-v1",
  "counting_policy": "total_server_prompt_including_template",
  "notes": "Illustrates schema only. 1 RPS is not a capacity estimate. Builder must replace unresolved values; real evaluator refuses example_only.",
  "suite_role": "diagnostic",
  "output_policy": "forced_length",
  "traffic_mode": "independent_open_loop",
  "history_mode": "single_turn",
  "offered_load": 1,
  "load_unit": "requests_per_s",
  "workload_card_path": "TO_BE_PREPARED/card.json",
  "workload_card_sha256": "UNRESOLVED",
  "source_manifest": {
    "source_id": "synthetic-mechanical-control",
    "revision_or_hash": "UNRESOLVED",
    "split": "diagnostic",
    "characterization_status": "not_applicable",
    "limitations": [
      "Shape control, not evidence of realistic agent traffic."
    ]
  },
  "preparation_policy_path": "TO_BE_PREPARED/preparation.json",
  "dependency_policy_path": null
}
